URL,HTTP_STATUS,TITLE,AFFILIATE,IMAGE,PRICE
https://comparapreco.github.io,200,Radar Ninja — As Melhores Ofertas do Mercado Livre Hoje,N/A,N/A,N/A
https://comparapreco.github.io/,200,Radar Ninja — As Melhores Ofertas do Mercado Livre Hoje,N/A,N/A,N/A
https://comparapreco.github.io/categorias/,200,Todas as Categorias | Radar Ninja,N/A,N/A,N/A
https://comparapreco.github.io/categorias/apple/,200,Ofertas de Apple com Desconto no Compara Preço,N/A,N/A,N/A
https://comparapreco.github.io/categorias/asus/,200,Ofertas de Asus com Desconto no Compara Preço,N/A,N/A,N/A
https://comparapreco.github.io/categorias/beleza/,200,Ofertas de Beleza com Desconto no Compara Preço,N/A,N/A,N/A
https://comparapreco.github.io/categorias/casa/,200,Ofertas de Casa com Desconto no Compara Preço,N/A,N/A,N/A
https://comparapreco.github.io/categorias/celulares/,200,"Celulares: Guia Completo, Ofertas e Comparativos",N/A,N/A,N/A
https://comparapreco.github.io/categorias/eletrodomesticos/,200,Air Fryers e Eletrodomésticos: Melhores Preços e Guia de Compra,N/A,N/A,N/A
https://comparapreco.github.io/categorias/ferramentas/,200,Ofertas de Ferramentas com Desconto no Compara Preço,N/A,N/A,N/A
https://comparapreco.github.io/categorias/gamer/,200,Ofertas de Gamer com Desconto no Compara Preço,N/A,N/A,N/A
https://comparapreco.github.io/categorias/games/,200,Ofertas de Games com Desconto no Compara Preço,N/A,N/A,N/A
https://comparapreco.github.io/categorias/informatica/,200,Ofertas de Informatica com Desconto no Compara Preço,N/A,N/A,N/A
https://comparapreco.github.io/categorias/jbl/,200,Ofertas de Jbl com Desconto no Compara Preço,N/A,N/A,N/A
https://comparapreco.github.io/categorias/lg/,200,Ofertas de Lg com Desconto no Compara Preço,N/A,N/A,N/A
https://comparapreco.github.io/categorias/monitores/,200,"Monitores: Melhores Preços, Guia de Compra e Comparativos",N/A,N/A,N/A
https://comparapreco.github.io/categorias/motorola/,200,Ofertas de Motorola com Desconto no Compara Preço,N/A,N/A,N/A
https://comparapreco.github.io/categorias/moveis/,200,Ofertas de Moveis com Desconto no Compara Preço,N/A,N/A,N/A
https://comparapreco.github.io/categorias/notebooks/,200,"Notebooks: Melhores Ofertas, Guia de Compra e Comparativos",N/A,N/A,N/A
https://comparapreco.github.io/categorias/outros/,200,Ofertas de Outros com Desconto no Compara Preço,N/A,N/A,N/A
https://comparapreco.github.io/categorias/philco/,200,Ofertas de Philco com Desconto no Compara Preço,N/A,N/A,N/A
https://comparapreco.github.io/categorias/samsung/,200,Ofertas de Samsung com Desconto no Compara Preço,N/A,N/A,N/A
https://comparapreco.github.io/categorias/tecnologia/,200,Ofertas de Tecnologia com Desconto no Compara Preço,N/A,N/A,N/A
https://comparapreco.github.io/categorias/tv-e-video/,200,"Smart TVs: Melhores Preços, Guia de Compra e Comparativos",N/A,N/A,N/A
https://comparapreco.github.io/contato/,200,Contato | Fale com a Equipe do Compara Preço,N/A,N/A,N/A
https://comparapreco.github.io/disclaimer/,200,Disclaimer — Compara Preço,N/A,N/A,N/A
https://comparapreco.github.io/melhores-2026/melhores-celulares-2026.html,200,Melhores Celulares de 2026 — Ranking Atualizado | Compara Preço,N/A,N/A,N/A
https://comparapreco.github.io/noticias/,200,Notícias de Tecnologia e Promoções — Lançamentos e Cupons | Compara Preço,N/A,N/A,N/A
https://comparapreco.github.io/noticias/posts/analise-800mlgarrafa-termica-agua-squeeze-inox-academiaquente-e-frio-20260608-40.html,200,Análise: 800mlgarrafa Térmica Água Squeeze Inox Academiaquente E Frio vale a pena com 52% OFF? | Compara Preço,N/A,N/A,N/A
https://comparapreco.github.io/noticias/posts/analise-aparador-de-pelos-multigroom-8-em-1-mg3917-15-philips-preto-127-220v.html,200,Análise: Aparador De Pelos Multigroom 8 Em 1 Mg3917/15 Philips Preto 127/220v vale a pena com 47% OFF? | Compara Preço,N/A,N/A,N/A
https://comparapreco.github.io/noticias/posts/analise-apple-iphone-16-128-gb-verde-acinzentado-distribuidor-autorizado-20260608-21.html,200,Análise: Apple iPhone 16 (128 Gb) / Verde-acinzentado / Distribuidor Autorizado vale a pena com 57% OFF? | Compara Preço,N/A,N/A,N/A
https://comparapreco.github.io/noticias/posts/analise-asus-consola-portatil-512-gb-white-z2-rc73ya-nh003w-rog-xbox-ally-asus.html,200,Análise: Asus Consola Portátil 512 Gb White Z2 Rc73ya-nh003w Rog Xbox Ally Asus Ryzen Z2 Wh Branco vale a pena com 46% OFF? | Compara Preço,N/A,N/A,N/A
https://comparapreco.github.io/noticias/posts/analise-asus-rog-ally-z1-extreme-512gb-vale-a-pena-com-47-off.html,200,Análise: Asus ROG Ally Z1 Extreme 512GB vale a pena com 47% OFF? | Compara Preço,N/A,N/A,N/A
https://comparapreco.github.io/noticias/posts/analise-bicicleta-ergometrica-fitness-para-cardio-e-musculacao-com-base-20260608-17.html,200,Análise: Bicicleta Ergométrica Fitness Para Cardio E Musculação Com Base Cor Preto E Vermelho 6kg Inercia Marca Sevenfit vale a pena com 61% OFF? | Compara Preço,N/A,N/A,N/A
https://comparapreco.github.io/noticias/posts/analise-cadeira-escritorio-ergonomica-giratoria-com-apoio-lombar-da-python-fly.html,200,Análise: Cadeira Escritório Ergonômica Giratória Com Apoio Lombar Da Python Fly Preto Malha vale a pena com 48% OFF? | Compara Preço,N/A,N/A,N/A
https://comparapreco.github.io/noticias/posts/analise-cadeira-gamer-profissional-reclinavel-apoio-de-pes-x-ray-20260608-38.html,200,Análise: Cadeira Gamer Profissional Reclinável Apoio De Pés X-ray vale a pena com 52% OFF? | Compara Preço,N/A,N/A,N/A
https://comparapreco.github.io/noticias/posts/analise-cadeira-gamer-python-fly-violeta-ergonomica-altura-regulavel-20260608-18.html,200,Análise: Cadeira Gamer Python Fly Violeta Ergonômica Altura Regulável Couro Sintético vale a pena com 60% OFF? | Compara Preço,N/A,N/A,N/A
https://comparapreco.github.io/noticias/posts/analise-cadeira-gamer-wells-preta-healer-preto-couro-sintatico-20260608-47.html,200,Análise: Cadeira Gamer Wells Preta Healer Preto Couro Sintético vale a pena com 50% OFF? | Compara Preço,N/A,N/A,N/A
https://comparapreco.github.io/noticias/posts/analise-camera-seguranca-wifi-ip-lente-dupla-2x-3mp-externa-360-a-prova-20260608-43.html,200,Análise: Câmera Segurança Wifi Ip Lente Dupla 2x 3mp Externa 360° A Prova Dágua Cor Cinza vale a pena com 51% OFF? | Compara Preço,N/A,N/A,N/A
https://comparapreco.github.io/noticias/posts/analise-carregador-30w-turbo-para-iphone-8-x-xr-11-12-13-14-pro-max-20260608-6.html,200,Análise: Carregador 30w Turbo Para iPhone 8 X Xr 11 12 13 14 Pro Max Fonte Usb C Cor Branca Dtimp Branco vale a pena com 66% OFF? | Compara Preço,N/A,N/A,N/A
https://comparapreco.github.io/noticias/posts/analise-carregador-30w-turbo-para-iphone-8-x-xr-11-12-13-14-pro-max-fonte-usb-c.html,200,Análise: Carregador 30w Turbo Para iPhone 8 X Xr 11 12 13 14 Pro Max Fonte Usb C Cor Branca Dtimp Branco vale a pena com 66% OFF? | Compara Preço,N/A,N/A,N/A
https://comparapreco.github.io/noticias/posts/analise-celular-samsung-galaxy-a07-128gb-4gb-ram-preto-20260608-33.html,200,Análise: Celular Samsung Galaxy A07 128gb 4gb Ram Preto vale a pena com 52% OFF? | Compara Preço,N/A,N/A,N/A
https://comparapreco.github.io/noticias/posts/analise-celular-samsung-galaxy-a07-256gb-8gb-camera-50mp-tela-6-7-protecao-ip54.html,200,"Análise: Celular Samsung Galaxy A07 256gb, 8gb, Câmera 50mp, Tela 6.7 , Proteção Ip54, Processador 6nm - Preto vale a pena com 55% OFF? | Compara Preço",N/A,N/A,N/A
https://comparapreco.github.io/noticias/posts/analise-celular-samsung-galaxy-a07-256gb-8gb-camera-50mp-verde-20260608-9.html,200,Análise: Celular Samsung Galaxy A07 256gb 8gb Câmera 50mp Verde vale a pena com 64% OFF? | Compara Preço,N/A,N/A,N/A
https://comparapreco.github.io/noticias/posts/analise-celular-samsung-galaxy-a17-5g-com-ia-128gb-4gb-ram-cam-de-50mp-20260608-24.html,200,"Análise: Celular Samsung Galaxy A17 5g Com Ia, 128gb, 4gb Ram, Câm De 50mp, Tela De 6.7, Nfc, Ip54 / Preto vale a pena com 55% OFF? | Compara Preço",N/A,N/A,N/A
https://comparapreco.github.io/noticias/posts/analise-celular-samsung-galaxy-a17-5g-com-ia-128gb-4gb-ram-cam-de-50mp-tela-de.html,200,"Análise: Celular Samsung Galaxy A17 5g Com Ia, 128gb, 4gb Ram, Câm De 50mp, Tela De 6.7 , Nfc, Ip54 - Cinza vale a pena com 55% OFF? | Compara Preço",N/A,N/A,N/A
https://comparapreco.github.io/noticias/posts/analise-celular-samsung-galaxy-a36-5g-256gb-8gb-ram-branco-20260608-28.html,200,Análise: Celular Samsung Galaxy A36 5g 256gb 8gb Ram Branco vale a pena com 54% OFF? | Compara Preço,N/A,N/A,N/A
https://comparapreco.github.io/noticias/posts/analise-chapinha-de-cabelo-mq-professional-titanium-pro-480-cor-chumbo-127-220v.html,200,Análise: Chapinha De Cabelo Mq Professional Titanium Pro 480 Cor Chumbo 127/220v vale a pena com 67% OFF? | Compara Preço,N/A,N/A,N/A
https://comparapreco.github.io/noticias/posts/analise-chapinha-de-cabelo-mq-professional-titanium-pro-480-cor-chumbo-20260608-41.html,200,Análise: Chapinha De Cabelo Mq Professional Titanium Pro 480 Cor Chumbo 127/220v vale a pena com 51% OFF? | Compara Preço,N/A,N/A,N/A
https://comparapreco.github.io/noticias/posts/analise-colchao-solteiro-molas-qatar-88x188x22cm-bege-branco-inducol-20260608-12.html,200,Análise: Colchão Solteiro Molas Qatar 88x188x22cm Bege/branco Inducol Cor Bege vale a pena com 64% OFF? | Compara Preço,N/A,N/A,N/A
https://comparapreco.github.io/noticias/posts/analise-console-sony-playstation-5-edicao-slim-disk-1tb-branco-controle-20260608-46.html,200,Análise: Console Sony Playstation 5 Edição Slim Disk 1tb Branco + Controle Sem Fio Dualsense Ps5 Branco vale a pena com 50% OFF? | Compara Preço,N/A,N/A,N/A
https://comparapreco.github.io/noticias/posts/analise-controle-gamepad-gamesir-x5-lite-usb-c-android-iphone-15-16-20260608-15.html,200,Análise: Controle Gamepad Gamesir X5 Lite Usb-c Android iPhone 15/16 Mobile Hall Effect Turbo Leve Preto vale a pena com 62% OFF? | Compara Preço,N/A,N/A,N/A
https://comparapreco.github.io/noticias/posts/analise-controle-sem-fio-dualsense-chroma-teal-ps5-sony-cfi-zct1w-cor-20260608-1.html,200,Análise: Controle Sem Fio Dualsense Chroma Teal Ps5 Sony Cfi-zct1w Cor Verde vale a pena com 72% OFF? | Compara Preço,N/A,N/A,N/A
https://comparapreco.github.io/noticias/posts/analise-controle-sem-fio-dualsense-chroma-teal-ps5-sony-cfi-zct1w-cor-verde.html,200,Análise: Controle Sem Fio Dualsense Chroma Teal Ps5 Sony Cfi-zct1w Cor Verde vale a pena com 72% OFF? | Compara Preço,N/A,N/A,N/A
https://comparapreco.github.io/noticias/posts/analise-controle-sem-fio-dualsense-edge-midnight-black-ps5-preto-20260608-25.html,200,Análise: Controle Sem Fio Dualsense Edge Midnight Black Ps5 Preto vale a pena com 55% OFF? | Compara Preço,N/A,N/A,N/A
https://comparapreco.github.io/noticias/posts/analise-controle-sem-fio-joystick-bluetooth-para-ps4-videogame-tv-20260608-2.html,200,Análise: Controle Sem Fio Joystick Bluetooth Para Ps4 Videogame Tv Samsung Pc P4 Ps 4 Dual Shock Manete Pc Gamer Tv Smart vale a pena com 69% OFF? | Compara Preço,N/A,N/A,N/A
https://comparapreco.github.io/noticias/posts/analise-controle-sem-fio-microsoft-xbox-series-s-x-one-pc-pulse-red-20260608-3.html,200,Análise: Controle Sem Fio Microsoft Xbox Series S X One Pc Pulse Red vale a pena com 69% OFF? | Compara Preço,N/A,N/A,N/A
https://comparapreco.github.io/noticias/posts/analise-controle-sem-fio-microsoft-xbox-series-s-x-one-pc-pulse-red-vale-a-pena.html,200,Análise: Controle Sem Fio Microsoft Xbox Series S X One Pc Pulse Red vale a pena com 69% OFF? | Compara Preço,N/A,N/A,N/A
https://comparapreco.github.io/noticias/posts/analise-cooktop-a-gas-fischer-4-bocas-fit-line-trempe-esmaltada-aramado-20260608-19.html,200,Análise: Cooktop A Gás Fischer 4 Bocas Fit Line Trempe Esmaltada Aramado Preto 127/220v vale a pena com 59% OFF? | Compara Preço,N/A,N/A,N/A
https://comparapreco.github.io/noticias/posts/analise-cooktop-a-gas-fischer-4-bocas-fit-line-trempe-esmaltada-aramado-preto.html,200,Análise: Cooktop A Gás Fischer 4 Bocas Fit Line Trempe Esmaltada Aramado Preto 127/220v vale a pena com 59% OFF? | Compara Preço,N/A,N/A,N/A
https://comparapreco.github.io/noticias/posts/analise-cortina-3-00x2-80-metros-blackout-blecaute-avela-corta-luz-em-20260608-45.html,200,"Análise: Cortina 3, 00x2, 80 Metros Blackout Blecaute Avelã Corta Luz Em Tecido Grosso Para Quarto E Sala Casa Laura vale a pena com 51% OFF? | Compara Preço",N/A,N/A,N/A
https://comparapreco.github.io/noticias/posts/analise-creatina-monohidratada-pura-1kg-dark-lab-unidade-sem-sabor-vale-a-pena.html,200,Análise: Creatina Monohidratada Pura 1kg Dark Lab Unidade Sem Sabor vale a pena com 56% OFF? | Compara Preço,N/A,N/A,N/A
https://comparapreco.github.io/noticias/posts/analise-creatina-monohidratada-pura-500g-dark-lab-unidade-sem-sabor-20260608-8.html,200,Análise: Creatina Monohidratada Pura 500g Dark Lab Unidade Sem Sabor vale a pena com 65% OFF? | Compara Preço,N/A,N/A,N/A
https://comparapreco.github.io/noticias/posts/analise-creatina-monohidratada-pura-500g-dark-lab-unidade-sem-sabor-vale-a-pena.html,200,Análise: Creatina Monohidratada Pura 500g Dark Lab Unidade Sem Sabor vale a pena com 65% OFF? | Compara Preço,N/A,N/A,N/A
https://comparapreco.github.io/noticias/posts/analise-fone-de-ouvido-headphone-dapon-h02d-bluetooth-5-1-over-ear-22h-20260608-42.html,200,Análise: Fone De Ouvido Headphone Dapon H02d Bluetooth 5.1 Over-ear 22h Preto vale a pena com 51% OFF? | Compara Preço,N/A,N/A,N/A
https://comparapreco.github.io/noticias/posts/analise-fritadeira-air-fryer-forno-oven-12l-mondial-afon-12l-ab-preto-20260608-16.html,200,Análise: Fritadeira Air Fryer Forno Oven 12l Mondial Afon-12l-ab Preto 127v vale a pena com 61% OFF? | Compara Preço,N/A,N/A,N/A
https://comparapreco.github.io/noticias/posts/analise-furadeira-parafusadeira-impacto-bateria-21v-bivolt-vale-a-pena-com-50.html,200,Análise: Furadeira Parafusadeira Impacto Bateria 21v Bivolt vale a pena com 50% OFF? | Compara Preço,N/A,N/A,N/A
https://comparapreco.github.io/noticias/posts/analise-havit-fone-de-ouvido-headset-gamer-fuxi-h3-quad-mode-com-fio-e-20260608-29.html,200,"Análise: Havit Fone De Ouvido Headset Gamer Fuxi-h3 Quad-mode (com Fio E Sem Fio, Wireless 2, 4ghz, Bluetooth, Cabo Usb-c vale a pena com 54% OFF? | Compara Preço",N/A,N/A,N/A
https://comparapreco.github.io/noticias/posts/analise-headset-qcy-h3-anc-adaptativo-bluetooth-5-3-multiponto-60h-cor-20260608-23.html,200,Análise: Headset Qcy H3 Anc Adaptativo Bluetooth 5.3 Multiponto 60h Cor Preto vale a pena com 56% OFF? | Compara Preço,N/A,N/A,N/A
https://comparapreco.github.io/noticias/posts/analise-headset-qcy-h3-lite-anc-bluetooth-5-3-multiponto-60h-cor-preto-20260608-14.html,200,Análise: Headset Qcy H3 Lite Anc Bluetooth 5.3 Multiponto 60h Cor Preto vale a pena com 63% OFF? | Compara Preço,N/A,N/A,N/A
https://comparapreco.github.io/noticias/posts/analise-jogo-6-copos-diamond-egipcio-300ml-vidro-grosso-diamante-luxo.html,200,Análise: Jogo 6 Copos Diamond Egipcio 300ml Vidro Grosso Diamante Luxo Transparente Vitrex vale a pena com 54% OFF? | Compara Preço,N/A,N/A,N/A
https://comparapreco.github.io/noticias/posts/analise-jogo-chave-catraca-reversivel-soquete-46-pecas-maleta-vale-a-pena-com.html,200,Análise: Jogo Chave Catraca Reversível Soquete 46 Peças Maleta vale a pena com 48% OFF? | Compara Preço,N/A,N/A,N/A
https://comparapreco.github.io/noticias/posts/analise-kit-10-pote-de-vidro-marmita-hermatico-640ml-freezer-fitness-20260608-10.html,200,Análise: Kit 10 Pote De Vidro Marmita Hermético 640ml Freezer Fitness Rishon Azul-escuro vale a pena com 64% OFF? | Compara Preço,N/A,N/A,N/A
https://comparapreco.github.io/noticias/posts/analise-kit-10-pote-de-vidro-marmita-hermetico-640ml-freezer-fitness-rishon-2.html,200,Análise: Kit 10 Pote De Vidro Marmita Hermético 640ml Freezer Fitness Rishon Azul-escuro vale a pena com 71% OFF? | Compara Preço,N/A,N/A,N/A
https://comparapreco.github.io/noticias/posts/analise-kit-10-pote-de-vidro-marmita-hermetico-640ml-freezer-fitness-rishon.html,200,Análise: Kit 10 Pote De Vidro Marmita Hermético 640ml Freezer Fitness Rishon Azul-escuro vale a pena com 64% OFF? | Compara Preço,N/A,N/A,N/A
https://comparapreco.github.io/noticias/posts/analise-kit-2-camera-seguranaa-ip-interna-externa-wifi-icsee-20260608-48.html,200,Análise: Kit 2 Câmera Segurança Ip Interna Externa Wifi Icsee Infravermelho Prova Dágua / Hw Branco vale a pena com 50% OFF? | Compara Preço,N/A,N/A,N/A
https://comparapreco.github.io/noticias/posts/analise-kit-2-camera-wifi-externa-a28-app-icsee-dupla-visao-3mp-prova-20260608-4.html,200,Análise: Kit 2 Câmera Wifi Externa A28 App Icsee Dupla Visão 3mp Prova Dágua Cor Branco vale a pena com 69% OFF? | Compara Preço,N/A,N/A,N/A
https://comparapreco.github.io/noticias/posts/analise-kit-2-short-duplo-compressao-fitness-bermuda-treino-feminino-20260608-30.html,200,Análise: Kit 2 Short Duplo Compressão Fitness Bermuda Treino Feminino vale a pena com 54% OFF? | Compara Preço,N/A,N/A,N/A
https://comparapreco.github.io/noticias/posts/analise-kit-body-splash-masculino-barbarius-enigma-midtown-200ml-vale-a-pena.html,200,Análise: Kit Body Splash Masculino Barbarius + Enigma + Midtown 200ml vale a pena com 36% OFF? | Compara Preço,N/A,N/A,N/A
https://comparapreco.github.io/noticias/posts/analise-kit-c-36-envelopes-252-cromos-copa-do-mundo-fifa-2026-20260608-50.html,200,Análise: Kit C/ 36 Envelopes (252 Cromos) / Copa Do Mundo Fifa 2026 vale a pena com 49% OFF? | Compara Preço,N/A,N/A,N/A
https://comparapreco.github.io/noticias/posts/analise-kit-c-36-envelopes-252-cromos-copa-do-mundo-fifa-2026-vale-a-pena-com.html,200,Análise: Kit C/ 36 Envelopes (252 Cromos) - Copa Do Mundo Fifa 2026 vale a pena com 49% OFF? | Compara Preço,N/A,N/A,N/A
https://comparapreco.github.io/noticias/posts/analise-lustre-led-sala-moderno-60w-3-arcos-pendente-luminaria-teto-127-220v.html,200,"Análise: Lustre Led Sala Moderno 60w, 3 Arcos Pendente Luminária Teto 127/220v Dourado vale a pena com 46% OFF? | Compara Preço",N/A,N/A,N/A
https://comparapreco.github.io/noticias/posts/analise-malbec-100ml-boticario-20260608-36.html,200,Análise: Malbec 100ml Boticário vale a pena com 52% OFF? | Compara Preço,N/A,N/A,N/A
https://comparapreco.github.io/noticias/posts/analise-micro-ondas-electrolux-de-bancada-branco-com-funcao-tira-odor-e-20260608-37.html,200,Análise: Micro-ondas Electrolux De Bancada Branco Com Função Tira Odor E Manter Aquecido 34l Meo44 127v vale a pena com 52% OFF? | Compara Preço,N/A,N/A,N/A
https://comparapreco.github.io/noticias/posts/analise-microfone-gamer-pc-com-braao-articulado-condensador-rgb-preto-20260608-31.html,200,Análise: Microfone Gamer Pc Com Braço Articulado Condensador Rgb Preto vale a pena com 54% OFF? | Compara Preço,N/A,N/A,N/A
https://comparapreco.github.io/noticias/posts/analise-microfone-lapela-redondo-sem-fio-tipo-c-duplo-anti-ruido-p-20260608-34.html,200,Análise: Microfone Lapela Redondo Sem Fio Tipo-c Duplo Anti Ruído P/ Android E iPhone 15 16 17 Com Caixinha Para vale a pena com 52% OFF? | Compara Preço,N/A,N/A,N/A
https://comparapreco.github.io/noticias/posts/analise-monitor-gamer-aoc-21-5-full-hd-gaming-120hz-1ms-22b30hm23-cor-preto-127.html,200,Análise: Monitor Gamer Aoc 21.5'' Full Hd Gaming 120hz 1ms 22b30hm23 Cor Preto 127/220v vale a pena com 42% OFF? | Compara Preço,N/A,N/A,N/A
https://comparapreco.github.io/noticias/posts/analise-parafusadeira-e-furadeira-impacto-the-black-tools-tb-21pw-3-8-20260608-1.html,200,Análise: Parafusadeira E Furadeira Impacto The Black Tools Tb-21pw 3/8 Cor Amarelo Frequência 50/60 Hz 127/220v 60hz vale a pena com 73% OFF? | Compara Preço,N/A,N/A,N/A
https://comparapreco.github.io/noticias/posts/analise-parafusadeira-furadeira-c-2-baterias-maleta-kit-completo-led-20260608-22.html,200,Análise: Parafusadeira Furadeira C/ 2 Baterias Maleta Kit Completo Led Eixo Flexível Vários Níveis Torque Amarelo vale a pena com 57% OFF? | Compara Preço,N/A,N/A,N/A
https://comparapreco.github.io/noticias/posts/analise-parafusadeira-furadeira-c-2-baterias-maleta-kit-completo-led-eixo.html,200,Análise: Parafusadeira Furadeira C/ 2 Baterias Maleta Kit Completo Led Eixo Flexível Vários Níveis Torque Amarelo 127/220v 60 Hz vale a pena com 57% OFF? | Compara Preço,N/A,N/A,N/A
https://comparapreco.github.io/noticias/posts/analise-perfume-arabe-feminino-yara-lattafa-eau-de-parfum-100-ml-vale-a-pena.html,200,Análise: Perfume Árabe Feminino Yara Lattafa Eau De Parfum 100 Ml vale a pena com 68% OFF? | Compara Preço,N/A,N/A,N/A
https://comparapreco.github.io/noticias/posts/analise-perfume-armaf-club-de-nuit-intense-105ml-edt-masculino-20260608-32.html,200,Análise: Perfume Armaf Club De Nuit Intense 105ml Edt / Masculino vale a pena com 53% OFF? | Compara Preço,N/A,N/A,N/A
https://comparapreco.github.io/noticias/posts/analise-perfume-asad-elixir-lattafa-arabe-original-nota-fiscal-vale-a-pena-com.html,200,Análise: Perfume Asad Elixir Lattafa Árabe Original Nota Fiscal vale a pena com 67% OFF? | Compara Preço,N/A,N/A,N/A
https://comparapreco.github.io/noticias/posts/analise-perfume-masculino-eau-de-parfum-azzaro-the-most-wanted-intense-20260608-44.html,200,Análise: Perfume Masculino Eau De Parfum Azzaro The Most Wanted Intense 100 Ml vale a pena com 51% OFF? | Compara Preço,N/A,N/A,N/A
https://comparapreco.github.io/noticias/posts/analise-perfume-sedutor-arabe-sabah-100ml-original-feminino-20260608-49.html,200,Análise: Perfume Sedutor Árabe Sabah 100ml Original Feminino vale a pena com 49% OFF? | Compara Preço,N/A,N/A,N/A
https://comparapreco.github.io/noticias/posts/analise-perfume-sedutor-arabe-sabah-100ml-original-feminino-20260608-5.html,200,Análise: Perfume Sedutor Árabe Sabah 100ml Original Feminino vale a pena com 67% OFF? | Compara Preço,N/A,N/A,N/A
https://comparapreco.github.io/noticias/posts/analise-perfume-sedutor-arabe-sabah-100ml-original-feminino-vale-a-pena-com-49.html,200,Análise: Perfume Sedutor Árabe Sabah 100ml Original Feminino vale a pena com 49% OFF? | Compara Preço,N/A,N/A,N/A
https://comparapreco.github.io/noticias/posts/analise-projetor-hy320-davely-smart-tv-android-wifi-6-390-ansi-lumens-20260608-11.html,200,Análise: Projetor Hy320 Davely Smart Tv Android Wifi 6 390 Ansi Lumens Full Hd Suporte 4k Hdmi Bluetooth 85-200 Polegadas vale a pena com 64% OFF? | Compara Preço,N/A,N/A,N/A
https://comparapreco.github.io/noticias/posts/analise-projetor-mini-bettdow-ac1073-22000lm-1080p-cor-preto-127-220v-20260608-39.html,200,Análise: Projetor Mini Bettdow Ac1073 22000lm 1080p Cor Preto 127/220v vale a pena com 52% OFF? | Compara Preço,N/A,N/A,N/A
https://comparapreco.github.io/noticias/posts/analise-samsung-galaxy-a07-256gb-8gb-verde-vale-a-pena-com-35-off.html,200,Análise: Samsung Galaxy A07 256GB 8GB Verde vale a pena com 35% OFF? | Compara Preço,N/A,N/A,N/A
https://comparapreco.github.io/noticias/posts/analise-samsung-galaxy-tab-a11-5g-6gb-128gb-cinza-vale-a-pena-com-49-off.html,200,"Análise: Samsung Galaxy Tab A11+ 5g 6gb, 128gb Cinza vale a pena com 49% OFF? | Compara Preço",N/A,N/A,N/A
https://comparapreco.github.io/noticias/posts/analise-samsung-galaxy-watch7-smartwatch-44mm-bt-galaxy-ai-verde-20260608-7.html,200,Análise: Samsung Galaxy Watch7 Smartwatch 44mm Bt Galaxy Ai / Verde vale a pena com 66% OFF? | Compara Preço,N/A,N/A,N/A
https://comparapreco.github.io/noticias/posts/analise-secador-de-cabelos-philco-psc3500-4-em-1-dobravel-motor-bldc-20260608-26.html,200,Análise: Secador De Cabelos Philco psc3500 4 Em 1 dobrável motor bldc Prateado Bege 220v vale a pena com 55% OFF? | Compara Preço,N/A,N/A,N/A
https://comparapreco.github.io/noticias/posts/analise-secador-de-cabelos-philco-psc3500-4-em-1-dobravel-motor-bldc-prateado.html,200,Análise: Secador De Cabelos Philco psc3500 4 Em 1 dobrável motor bldc Prateado Bege 127v vale a pena com 36% OFF? | Compara Preço,N/A,N/A,N/A
https://comparapreco.github.io/noticias/posts/analise-serra-tico-tico-400w-110v-220v-profissional-madeira-vale-a-pena-com-37.html,200,Análise: Serra Tico Tico 400w 110v/220v Profissional Madeira vale a pena com 37% OFF? | Compara Preço,N/A,N/A,N/A
https://comparapreco.github.io/noticias/posts/analise-smart-tv-4k-75-lg-qned73-portal-de-games-processador-ai-7-ger8-20260608-35.html,200,Análise: Smart Tv 4k 75 LG Qned73 Portal De Games Processador Ai 7 Ger8 4k Super Upscaling Google Cast Integrado Controle vale a pena com 52% OFF? | Compara Preço,N/A,N/A,N/A
https://comparapreco.github.io/noticias/posts/analise-smart-tv-h5000f-hd-32-polegadas-2025-preto-samsung-bivolt-20260608-20.html,200,Análise: Smart Tv H5000f Hd 32 Polegadas 2025 Preto Samsung Bivolt vale a pena com 58% OFF? | Compara Preço,N/A,N/A,N/A
https://comparapreco.github.io/noticias/posts/analise-smart-tv-lg-uhd-ai-ua75-65-polegadas-hdr10-pro-processador-7-ai-ger8.html,200,Análise: Smart Tv LG Uhd Ai Ua75 65 Polegadas Hdr10 Pro Processador 7 Ai Ger8 Webos 25 vale a pena com 35% OFF? | Compara Preço,N/A,N/A,N/A
https://comparapreco.github.io/noticias/posts/analise-smart-tv-philco-40-p40vik-led-roku-dolby-audio-wi-hdmi-hdr-full-hd-110.html,200,Análise: Smart Tv Philco 40 P40vik Led Roku Dolby Audio Wi-fi Hdmi Hdr Full Hd 110/220v vale a pena com 38% OFF? | Compara Preço,N/A,N/A,N/A
https://comparapreco.github.io/noticias/posts/analise-smart-tv-philco-50-p50vik-4k-uhd-led-roku-dolby-audio-wi-hdr10-110-220v.html,200,Análise: Smart Tv Philco 50 P50vik 4k Uhd Led Roku Dolby Audio Wi-fi Hdr10 110/220v vale a pena com 43% OFF? | Compara Preço,N/A,N/A,N/A
https://comparapreco.github.io/noticias/posts/analise-smart-tv-samsung-32-ls32h5000fgxzd-hd-led-wifi-hdmi-110-220v-vale-a.html,200,Análise: Smart Tv Samsung 32 Ls32h5000fgxzd Hd Led Wifi Hdmi 110/220v vale a pena com 42% OFF? | Compara Preço,N/A,N/A,N/A
